Item,Sentence,all,a lot (of),,,,
176651:43,"a, a contractor friend helped me, uh, with [SOME] of the, uh, foundation work",Yes,Yes,,k,,
108182:30,i guess you have  to take [SOME] things and leave [SOME] things.,No; No,Yes; Yes,,,,"Sometimes I think that the of in a lot of helps though and the ""weird"" of all is more because I don't replace some with all OF, and because the concept of all doesn't apply but a lot does because whatever the scalar refers to is something that can't be completely something"
20718:26,"well, i know that we have [SOME] relatives that  live around, like the mumblex area in there,",No,Yes,,,,"a lot seems to not work when some means any, random"
18335:127,"just if you want a lot of, you know, light for underneath, that may be the, all right because we had, because we have some, we have [SOME] old fruit trees.",No,Yes,,It was yes if it sounded right without having to be framed in a particular context,,
88808:43,"although, um, i have also done oh, free lance magazine writing and [SOME] educational writing.",No,Yes,,some _____ that,,
148561:14,"i mean, [SOME] people sing,",Yes,Yes,,"you have some _____, some _____, it can't be all and all if it's referring to what composes a whole",,
176908:22,"and you say you have [SOME] strong feelings about, uh, the issue.",No,Yes,,there are some _____: because of the there are something that might work for all without the there are doesn't work,,
34501:47,"but it was on a higher level, you know, where there were [SOME] things that kids didn't understand  that adults did  ,",No,Yes,,"If a sentences needed me to create particular explanation or context to make the all replacement work, it was annotated as no",,
1686:32:00,"and, uh, quite honestly, i, i have [SOME] little children",No,Yes,,,,
9196:49:00,"but i do think that, um, congress has backed down much too much on [SOME] of the air pollution standards.",Yes,Yes,,,,
24580:124,"and, and it's and it's based  on, on a perception that someone has  as how a drug user would behave  when [SOME] drug users behave, uh, normal , uh, you know.",Yes,Yes,,,,
68658:113,"but, if there are [SOME] people who  don't agree uh, then there must be, it seems  to be there must be at least a reasonable doubt for [SOME] people.",No; Yes,Yes; Yes,,,,
16209:29,and i have two different kinds of breads and [SOME] ham,No,Yes,,,,
112844:32,"i have worked in anoth-, at [SOME] other ones that  were not very good in my opinion.",No,Yes,,,,
99256:38,"and you can see in [SOME] of the departments in [SOME] of the schools, like history at clark, they're all pretty fancy.",Yes; Yes,Yes; Yes,,,,
89238:15,and she was wanting [SOME] more information.,No,Yes,,,,
86088:57,"and i, i think we may not have ever have seen that without [SOME] of these, uh, newspeople being in there in the broadcasts and the, the, uh, soldiers leaving, um, you know, surrendering and, trying  to get out of that situation.",Yes,Yes,,,,
112290:7,and [SOME] of those,Yes,Yes,,,,
145433:59,"even with my gas card you know, i find that i'll go in  to get [SOME] gas",No,Yes,,,,
77398:5,"some of the people that i work with  they, like when i worked on second shift , um, their paren-, their kids go to school during the day",Yes,Yes,,,,
102781:19,i went to dinner with [SOME] friends last weekend,No,Yes,,,,
80692:12,and you get [SOME] beautiful effects with them.,No,Yes,,,,
4490:19:00,"um, there's been [SOME] progressive medical schools  out here, that  have taken that approach.",No,Yes,,,,
176346:41,"he crashed and killed [SOME] people because he was, uh, smoking [SOME] marijuana",Yes; No,Yes; Yes,,,,
163367:85,but i think it's got a little more relevance since they are around dangerous equipment and things like that and do have  to exercise [SOME] quick judgment in the field.,No,Yes,,,,
134426:32,"and, uh, we've got [SOME] plum trees and [SOME] apple trees and [SOME] tomato and [SOME] blackberries and strawberries.",No (4),Yes (4),,,,
53223:87,"i, uh, i left t i in january  hoping  to strike out and find a job where i could make [SOME] money .",No,Yes,,,,
36420:35,"we've, uh, just save the fees and buy [SOME] of our own equipment.",Yes,Yes,,,,
95199:151,"but when time came  to direct their ability to make choices to develop the kinds of things that, that they're going  to need   to interact with other people  , i felt like i needed [SOME] strong influence there.",No,Yes,,,,
114255:29,"um, uh, i think there's [SOME] problems,",No,Yes,,,,
140052:14,"but my son needed [SOME] money,",No,Yes,,,,
155121:37,"uh, a colleague of mine at, uh, work got [SOME] information over, uh, the computer network called internet.",Yes,Yes,,,,
56319:15,and i shred up [SOME] just regular white cheese.,No,Yes,,,,
120254:15,"i've read [SOME] things about him that he was, he wasn't too good himself.",No,Yes,,,,
99947:44,"so but, uh, you know, we probably did [SOME] ice skating on it,",No,Yes,,,,
103563:4,"some people are really afraid to recycle the fuel because they're afraid it could become, uh, bomb quality.",Yes,Yes,,,,
35674:45,and so she's going  to get [SOME] money for that and take [SOME] money from the bank and then try  to make as much down payment as possible  to keep the monthly payment low.,No; No,Yes; Yes,,,,
140964:11,and spend [SOME] time with him.,No,Yes,,,,
47593:18,"then my father got us [SOME] tickets,",No,Yes,,,,
54511:40,"there's, there is, you know [SOME] blood and everything",No,Yes,,,,
38844:23,"i do do [SOME] crafts like it mentioned in the thing,",No,Yes,,,,
72387:13,and i see [SOME] of the problems the kids have  when they don't have a real good family structure .,Yes,Yes,,,,
15535:31,"now, i've seen, you know, [SOME] different clips of it, um,",No,Yes,,,,
91704:14,"i'm doing [SOME] reviews of books,  just to, what, to sort of recommend to wh-, whether or not a full-scale review should be done  for the journal,",No,Yes,,,,
29385:35,"and they go back and forth, where everyone's giving [SOME] opinions",No,Yes,,,,
165513:41,"and then with that i try and handle, you know, [SOME] of the clothes that the girls need  and things like that,",Yes,Yes,,,,
5156:27:00,"i've been trying  to do [SOME] bibs for him. and, uh, work on his christmas stocking.",No,Yes,,,,
71923:26,because i work [SOME] weird hours and do [SOME] traveling.,No; No,Yes; Yes,,,,
1177:17:00,"i've even had [SOME] of them,",Yes,Yes,,,,
109067:60,"marinated in olive oil and [SOME] seasoning, um, and cooked with [SOME] olives and some, and [SOME] prunes, uh,",No (3),Yes (3),,,,
8885:15:00,what  are [SOME] of your things you like  to do .,Yes,Yes,,,,
102431:45,"i know they do do some, they do have [SOME] classes   in, um, high schools and things for kids  to, uh, give them an idea of what family life is like  and the, uh, you know, and, uh, that kind of thing",No,Yes,,,,
57403:47,"it had, uh, leather, leather designs and, um, [SOME] other, other little things on it",No,Yes,,,,
88674:10,i did [SOME] typing for my father when he had the company,No,Yes,,,,
96886:11,there's [SOME] men out there that  are more feminine than most women.,No,Yes,,,,
9967:56:00,"they don't understand that to make that work, they've got  to take [SOME] responsibility for themselves.",Yes,Yes,,,,
97989:5,"some of the changing roles of women in that respect, i have been a product of .",Yes,Yes,,,,
2345:39:00,"i, uh, have attended [SOME] seminars that  had [SOME] tapes that  went with them, but, uh, i guess not so much books although they sometimes have manuals and things,",Yes; No,Yes; Yes,,,,
113850:63,"if they were  to take half of what they spend  on that and put it on [SOME] economic, you know, inter-, intergovernmental or inter united states like programs that one really might.",Yes,Yes,,,,
82800:12,"my wife did [SOME] teaching at like, uh, like a private tutoring place. a sylvan learning center this year",No,Yes,,,,
116717:11,i know [SOME] people that  went to b y u.,No,Yes,,,,
20142:232,"well, i think in a way, though, uh, uh, i also have, uh, an opposite point of view, which  is, uh, although i believe we should, uh, permit, uh, you know, constant immigration into this country uh, i think we should, uh, primarily for economic reasons, i think we should have, um, [SOME] quotas,",No,Yes,,,,
171282:63,"but i guess, i guess i like the system that they have  in [SOME] places where the defendant gets  to choose whether he's, goes before a jury for sentencing or whether the judge gets  to choose it .",Yes,Yes,,,,
1939:10:00,"i saw [SOME] promise, you know, with, with a lot of the new wave, when it, when it came out, uh, back in the mid and early eighties .",No,Yes,,,,
11991:7,"and [SOME] of it runs off right away into the, in to the streams and rivers",Yes,Yes,,,,
134021:50,"and i think that it's, it's very surprising [SOME] of these very expensive volvos can be gotten  for a lot less money than you would think if you're willing  to buy ones that  are about, the vintage of the cars that you and i currently own",Yes,Yes,,,,
15332:88,"everybody i know  has been, well, i'm going  to go  get a goo-, good job and make [SOME] money and buy a nice car.",No,Yes,,,,
145355:18,"uh, i got in [SOME] problems with, uh, financial problems because of credit cards",No,Yes,,,,
65999:146,"but, uh, you know, i think, uh, they, maybe they need  to, uh, help  promote that more. give incentives like, uh, if they do bring somebody on, they will pay [SOME] of their costs or give tax breaks or whatever it is , you know, for them to train people, you know, stuff like that.",Yes,Yes,,,,
137619:16,but they're doing [SOME] stomping on virginia.,No,Yes,,,,
161653:6,"but [SOME] people are more motorboaters, you know which  is fine.",Yes,Yes,,,,
126165:57,"i've got where now i can hit it in, in the air [SOME] of the time .",Yes,Yes,,,,
148538:10,i have [SOME] dulcimer music.,No,Yes,,,,
103624:72,"it's just, you know, a possible solution in the future, i think , maybe to help in [SOME] ways.",Yes,Yes,,,,
155962:19,"and i think also [SOME] of the, uh, car companies are coming out with, uh, gas powered fleets so you,",Yes,Yes,,,,
138291:103,"i'd, i'd kind of like  to, to look at equipment like a lathe or like you say, a table saw and [SOME] of those things that  would make, uh, [SOME] pretty nice, uh, pieces of, uh, well, wood, for, for different things for tables, for, for, uh, chairs, for, you know, decks and so forth",Yes; No,Yes; Yes,,,,
7267:12:00,"and painting and [SOME] wallpapering,",No,Yes,,,,
112156:136,"and, uh, you know, there was, there was, nothing on it, which  makes me wonder, you know, if it's as, uh, prevalent as, as [SOME] of them claim.",Yes,Yes,,,,
32005:38,"and his, uh, son built him a garage and got him some, uh, oh, i don't know what the equipment's called  , but planers and things and s-, set him up,",No,Yes,,,,
90995:20,i think that's [SOME] of it.,Yes,Yes,,,,
107909:42,and i don't know why we couldn't have duplicate voting on [SOME] of this .,Yes,Yes,,,,
78585:7,"so [SOME] of the things are not as, quite as, uh, adaptable.",Yes,Yes,,,,
94633:27,and it's a chance to see [SOME] of the relatives you don't see  all year long except that once a year.,Yes,Yes,,,,
164050:47,"but there's so many occasions when i've had  to move [SOME] members of the family or do this or that ,",Yes,Yes,,,,
65989:12,"so we had [SOME] interference,",No,Yes,,,,
109644:34,"so, i guess we're old timers compared to [SOME] people.",Yes,Yes,,,,
35565:48,"and, uh, if i consider  going the used car route and save up [SOME] money, i shouldn't have too much trouble at all.",No,Yes,,,,
47226:12,"and there's [SOME] pretty decent campgrounds although, i don't think raleigh, i don't think the state of north carolina takes,",No,Yes,,,,
98248:22,"and i think there are [SOME] people that  have done that,",No,Yes,,,,
30428:73,"then, you know, then, we thought, well we can use it for, you know, [SOME] personal things.",No,Yes,,,,
40634:72,"she gets home visitations by the s-, mumblex i don't know, the state boards, i guess, [SOME] of them and then [SOME] by the association,",Yes; Yes,Yes; Yes,,,,
23510:57,"and let's, you know, let's get rid  of [SOME] of this harassment suing.",Yes,Yes,,,,
121569:26,i just wish they'd bring [SOME] of the old characters back.,Yes,Yes,,,,
172264:114,"i mean, obviously, i do most of my, almost all of my report writing on, on my computer, uh, whether it's term papers or even [SOME] smaller homework assignments.",Yes,Yes,,,,
161396:28,"uh, and [SOME] of, [SOME] stuff that i like , uh,",Yes; No,Yes; Yes,,,,
5366:34:00,"uh, we had some, uh, [SOME] people from our church  went to israel, uh, just for a, uh, tour sort of thing.",No,Yes,,,,
12111:78,"the, uh, united states and canada are i guess, is, is, going into, uh, [SOME] types of agreements to limit, uh, what 's being given  out by power plants,",Yes,Yes,,,,
73491:25,"and, uh, when i seen [SOME] of my friends that  have taken that six week old baby, you know, to someone else , it's just, i can imagine how emotional it must be .",Yes,Yes,,,,
164075:14,"so, we got [SOME] monster studded snow tires after that.",No,Yes,,,,
121793:107,"you know, i want to, i want  to throw [SOME] charcoal on the grill and, and throw a steak  on there and [SOME] baked potatoes and stuff like that",No; No,Yes; Yes,,,,
53913:6,and [SOME] kids need  to be spanked  at home.,Yes,Yes,,,,
130087:11,what are [SOME] of the things they don't recycle  .,Yes,Yes,,,,
15291:54,"it's for, i think, at the same it's for [SOME] people to, you know, help them grow in other areas,",Yes,Yes,,,,
66765:5,"some of the cases i've heard about  over the years,",Yes,Yes,,,,
63606:10,"and then [SOME] of them are done  in, you know, purely metric.",Yes,Yes,,,,
134420:14,we put up [SOME] hummingbird feeders and [SOME] bird feeders.,No; No,Yes; Yes,,,,
74234:44,"i think the other thing is that, uh, we have taken [SOME] rather drastic turns in our, in our education and the way we approach things  as of maybe starting back when, when i'm number one, you know, and, uh, uh, uh, worrying about self and not, uh, seeing the consequences of the disintegration of the family .",No,Yes,,,,
105896:51,and i think it 's good that they're trying  to start [SOME] programs down in the elementary schools.,Yes,Yes,,,,
171124:6,some of that is really bad i think .,Yes,Yes,,,,
19728:11,where's [SOME] reference to this goddamn state of texas and the role that they played  either leading up to  or in  the civil war .,No,No,,,,
129583:26,i'm going  to look into [SOME] other fields.,Yes,Yes,,,,
28711:26,"and the guys that, [SOME] of the guys that  run this place are very tight",Yes,Yes,,,,
110359:35,"like just over the weekend i visited my family, and [SOME] cousins i hadn't seen  in a long time,",No,Yes,,,,
43673:87,"i just go  to be entertained  and and not really interested in [SOME] of the, like the terminator or [SOME] of the schwarzenegger stuff.",Yes,Yes,,,,
102546:21,and i'm not fond of [SOME] of those things,Yes,Yes,,,,
175724:80,"well, i, i, i think we did, i think we did learn [SOME] lessons that we weren't, uh, we weren't prepared for ,",No,Yes,,,,
158966:17,then i know of [SOME] of the people that  have gotten their masters,Yes,Yes,,,,
74757:171,"and i hope maybe we're going  to get somewhere with a little more attention being paid  to it with, uh, reagan's, uh, new education secretary and, uh, you know, trying to do some, uh, trying  to produce [SOME] new programs anyway.",No,Yes,,,,
126460:28,"but is it a legal, uh, solution for [SOME] companies.",Yes,Yes,,,,
62437:24,but i wonder if there aren't [SOME] sociology courses.,No,No,,,,
56101:53,"but, it  is comforting to me to see, uh, more concern about [SOME] of these things that, that  cost us money.",Yes,Yes,,,,
53610:9,caused [SOME] damage.,No,Yes,,,,
13087:15,"and, uh, [SOME] of those old ones , of course, bob wills, miss texas playboys ernest tubbs and red foley an,",Yes,Yes,,,,
76785:80,"i mean, you know, at [SOME] point a parent does help their kid, but in, in [SOME] ways,",No; Yes,No; Yes,,,,
142147:41,"and i do, i try  to do [SOME] arts and crafts",No,Yes,,,,
24418:16,they actually should do [SOME] reading,No,Yes,,,,
6686:61,"it would certainly help them to appreciate [SOME] of the things that we have  here and develop [SOME] pride in them, if it was handled  that way.",Yes; No,Yes; Yes,,,,
72579:15,but they usually have [SOME] good articles in it.,No,Yes,,,,
70670:14,"i've got [SOME] onions  out, tomatoes,",No,Yes,,,,
134426:23,"and, uh, we've got [SOME] plum trees and [SOME] apple trees and [SOME] tomato and [SOME] blackberries and strawberries.",No (4),Yes (4),,,,
8865:47:00,but one of the things that i do  when i've got [SOME] spare time  is i do [SOME] woodworking.,No; No,Yes; Yes,,,,
55933:33,and this would give them a chance  to have [SOME] positive self-esteem.,No,Yes,,,,
176952:43,"they always want  to be able  to, uh, do [SOME] brain draining.",No,Yes,,,,
136193:24,"and i saw, there were [SOME] stop signs, i mean, submerged up to the writing on the stop sign,",No,Yes,,,,
177474:15,"especially, i did [SOME] cabinets in, uh, ash and oak",Yes,Yes,,,,
150826:22,but i wonder if maybe in [SOME] civil cases it doesn't work as well.,Yes,Yes,,,,
108790:55,"and then [SOME] of it is, [SOME] of it actually gets into [SOME] serious discussions of problems in our, in urban society.",Yes; Yes; No,Yes; Yes; Yes,,,,
142499:11,there are [SOME] columns that  could be painted   a different color too.,No,Yes,,,,
155027:11,i have [SOME] friends of mine who  use quicken,No,Yes,,,,
11568:18,"in fact, it got [SOME] pretty serious deep parts in it",No,Yes,,,,
142849:33,"they need  to have some, [SOME] young guys that  can take the lead",No,Yes,,,,
97106:20,"it's, [SOME] good, [SOME] bad, uh,",Yes; Yes,Yes; Yes,,,,
3209:48:00,"so, so then we got, we got [SOME] same things because,",Yes,Yes,,,,
80299:13,"and there's [SOME] days it's just like it 's the hardest thing in the world to, to get started  .",No,Yes,,,,
122893:11,"that's [SOME] cold golf too, isn't it.",No,No,,,,
95645:100,"well, i, i feel in light of [SOME] of the accidents and so forth that  have happened lately, that i think there are [SOME] occupations that they should, such as the health field, the transportation field, uh,",Yes; No,Yes; Yes,,,,
153721:83,"they, i guess they passed a couple of, uh, uh, laws a here while back in [SOME] states in terms of a waiting period where you know you go  to buy a hand gun",Yes,Yes,,,,
163188:16,"uh, i bought [SOME] cokes  the other day in the br-, the little bottles you know,",No,Yes,,,,
64969:34,and i hope you get [SOME] more calls and make [SOME] more calls.,No,Yes,,,,
15903:5,"some of the places  now, um, like i b m don't allow them smoking, you know in, in the plant.",Yes,Yes,,,,
22630:77,"of course what i used  to like  to do  though is go  snorkeling for scallops  in [SOME] of the bays, or uh, or oy-, for oysters.",Yes,Yes,,,,
79355:11,"they had [SOME] bends , around that we could find and put them in",No,Yes,,,,
164038:17,"so, they've got [SOME] pretty powerful sixes.",No,No,,,,
168216:15,"but they get into [SOME] really good conversations sometimes, you know.",No,Yes,,,,
26819:29,"and, i think, that they could get [SOME] results from that, because there are a lot of people who  are volunteer and community minded,",Yes,Yes,,,,
148355:8,"even [SOME] of that i like  okay but not, mostly, as a general rule,",Yes,Yes,,,,
172629:33,"there ought  to be, uh, uh, [SOME] compromise that  could, where, uh, where the person would be guaranteed  a, uh, career type position but not necessarily a continuation of exactly the same position uh, in exchange for a longer period of time .",No,No,,,,
138142:20,"and, and [SOME] odd stuff around the house",No,Yes,,,,
103194:37,"my in-laws also enjoy prime rib, when they've had [SOME] of their specials on sunday, monday, or tuesday night",Yes,Yes,,,,
177013:13,"but there's [SOME] differences in the immigrants, that, that we're getting  now.",No,Yes,,,,
33002:13,"we've got [SOME] good, um, um, hybrid burpee uh uh, pickler cucumbers",No,Yes,,,,
168569:28,"i'm beginning  to believe that [SOME] people are simply not rehabilitatable and, uh, that, uh, uh, costs and other factors justify, uh, uh, executing people.",Yes,Yes,,,,
151077:31,"but, uh, apparently for some, [SOME] crimes, it 's permissible to have six people sit in judgment.",Yes,Yes,,,,
56897:6,"and [SOME] people don't vote,",Yes,Yes,,,,
166177:13,but there are [SOME] school districts out there that  are very well paid.,No,Yes,,,,
86100:21,you have  to have [SOME] compassion [SOME] humanness.,No; No,Yes; Yes,,,,
70612:21,living in the city has [SOME] advantages.,No,Yes,,,,
116495:21,"in fact, i just got [SOME] reservations.",No,Yes,,,,
26977:14,i've seen [SOME] districts where all the schools are lousy,No,Yes,,,,
39190:38,"i'd love  to have, have [SOME] animals.",No,Yes,,,,
169028:53,"uh, that 's kind of gone up in scale and, and [SOME] other things.",Yes,Yes,,,,
175702:23,"and i got a feeling that [SOME] of that was involved in the, uh, early decisions of the vietnam war. that the, uh, people saw the cold war as, uh, you had  to draw a line and, and defend it.",Yes,Yes,,,,
127596:32,"i've, i've done [SOME] water exercises,",No,Yes,,,,
164095:28,"so we've been able  to do [SOME] real creative, uh, load hauling when called upon  .",No,Yes,,,,
147477:43,"so, i, you know, you pick up [SOME] traits from her and stuff.",Yes,Yes,,,,
101121:88,"and schools now are supposed  to solve social problems, uh, mental and emotional problems as well as educate the kids and try  to provide them with [SOME] security.",No,Yes,,,,
103644:84,"i, i think, with solving [SOME] of the energy, future energy problems, we'll probably solve [SOME] of the pollution problems as well.",Yes; Yes,Yes; Yes,,,,
161001:72,"that's, that's, maybe that's, there's, uh, [SOME] credence in that statement.",No,Yes,,,,
31180:58,"and, uh, you know, i, i've, in hindsight, seen [SOME] things that i wished that, you know, i had done something about  that  was, you know, within my power or, uh, you know, wish that in [SOME] ways we, as parents, had more control over what 's happening up there, you know, type thing.",No; Yes,Yes,,,,
171692:24,"and, uh, they've had [SOME] financial problems with the team and so forth.",No,Yes,,,,
145552:67,"and i, i guess there's some, there's, uh, uh, [SOME] negotiating there, too,",No,Yes,,,,
128104:24,"i mean, they'll have [SOME] things  in there that  almost, almost, you know, like supernatural, or something, you know,",No,Yes,,,,
103911:47,"and, and, it really isn't, for [SOME] people tha-, who  have been there for over, and over, and over, it really isn't, uh, as bad.",Yes,Yes,,,,
23861:130,"and if you like chinese food, you can take filet of fish and put a little bit of soy sauce and a little bit of sesame oil on top of it and chop [SOME] scallions and a little ginger and just cover it with some, uh, waxed paper and steam it just until the fish is done,",No,Yes,,,,
164770:133,"one of the things that i found  interesting last year during the, uh, the gulf conflict was a sentiment against, uh, peter arnett, who  had stayed in iraq and was presenting, uh, [SOME] of the things that  were available.",Yes,Yes,,,,
78614:111,"i know that, uh, uh, one of, one thing that  happens to us to vacation trips now is that usually that try to involve [SOME] of the members of the family.",Yes,Yes,,,,
37768:13,cause i did [SOME] teaching part-time,Yes,Yes,,,,
89437:12,"and there were [SOME] others,",No,Yes,,,,
32931:10,we planted [SOME] yellow peppers this year.,No,Yes,,,,
156697:32,i'm for it in in [SOME] cases.,Yes,Yes,,,,
53912:14,"i mean, [SOME] kids don't get don't get spanked  at home",Yes,Yes,,,,
4795:25:00,"you know, i mean, [SOME] of these guys are forty years old and got ten convictions.",Yes,Yes,,,,
31080:8,"in [SOME] of those, you know, they, i guess they retitled [SOME] movies that  were going  to be about lebanese and, and, you know, and, and americans",Yes; Yes,Yes; Yes,,,,
127919:39,"so i don't, i don't know [SOME] of those shows now, like i used  to.",Yes,Yes,,,,
174160:14,i've got [SOME] friends that  are lawyers,No,Yes,,,,
47855:7,and [SOME] of the people in our church use birth control,Yes,Yes,,,,
57643:110,"i'm convinced that, uh, detroit or whoever it is  made a major mistake, years ago when they stopped  putting the small v eights in and went to the fours and [SOME] of the sixes .",Yes,Yes,,,,
78212:39,"and i know they do van pool a lot here from [SOME] of the outer areas,",Yes,Yes,,,,
6686:28:00,"it would certainly help them to appreciate [SOME] of the things that we have  here and develop [SOME] pride in them, if it was handled  that way.",Yes; No,Yes; Yes,,,,
92249:38,"and it was, uh, just to, uh, have [SOME] fellowship with her.",No,Yes,,,,
9486:04:00,"some people say, uh, they, they like  to watch the changing of the seasons",Yes,Yes,,,,
25479:56,"and, uh, we'll get out of the driving range and, and get [SOME] interest built  up",No,Yes,,,,
9970:53:00,when they give you the freedom to take care of yourself  then that puts [SOME] responsibility on you as well.,Yes,Yes,,,,
153227:28,"because i mean i do think that [SOME] people need them and, like, for protection and stuff",Yes,Yes,,,,
171919:12,"we do [SOME] cooking, [SOME] barbecueing, have a few drinks and then go in and see the game and see the patriots lose and then go home and eat, drink [SOME] more.",No; No; No,Yes; Yes; Yes,,,,
148200:15,"and then we have [SOME] church magazines,",No,Yes,,,,
85252:8,"interestingly [SOME] of the information i've been reading  indicates that the amount of air pollution from, uh, uh, airplanes is extraordinary.",Yes,Yes,,,,
161185:14,"i do have [SOME] thoughts on that,",No,Yes,,,,
