Item,Sentence,all,a lot (of),,,,
142780:82,"as far as the rangers are concerned , i think, i think they need some, definitely need [SOME] pitching.",No,Yes,,,,
2006:05:00,"some of it,",Yes,Yes,,,,
163703:15,"i think [SOME] of them, the artists are even, uh, hitting the pop charts.",Yes,Yes,,,,
7282:17:00,"kind of gives you [SOME] space for yourself,",Yes,Yes,,,,
157519:107,"i'd read one book, i think it was calls  trial by jury of all things, that, uh  went through and interviewed a bunch of jurors in [SOME] of the big cases, and in many cases  looking at what  had, at the evidence afterwards as to whether the decision was right, went back to the jurors, uh, based on the deliberations.",Yes,Yes,,,,
127350:66,"i've, i've heard they're, i hear you have [SOME] problems.",No,Yes,,,,
106267:29,i'd have  to go back through [SOME] expense reports.,Yes,Yes,,,,
143543:20,"and there are, uh, [SOME] fairly sophisticated approaches that  are used  in the high schools with point systems and things like that so that people, uh, gain a competence with respect to the material.",No,Yes,,,,
75025:28,"i mean we need  to redo some, rewiring ourselves",Yes,Yes,,,,
169902:90,"i, i think sometimes, you know, i've noticed, uh, people asking for, uh, [SOME] of the patients asking for things , uh, just repetitively and, but things that  are not reasonable,",Yes,Yes,,,,
69673:14,"they've mumblex [SOME] companies that  are doing, uh, hair tests.",Yes,Yes,,,,
42623:15,"i mean, [SOME] of these saturday night specials that these companies put  out, that  are, pie-, i mean, they're are",Yes,Yes,,,,
169857:78,"i think i'd look for a home where they got a lot of attention  and, uh, where they did [SOME] things  to try  to keep them, um, mentally alive . and where there was, uh, caring and compassionate, where there were caring and compassionate people, uh, operating it .",Yes,Yes,,,,
84633:31,"i mean, they are eighteen to twenty-four, [SOME] of the young men and women.",Yes,Yes,,,,
123034:17,"i know maybe [SOME] of the big things that, uh, uh,",Yes,Yes,,,,
32942:10,they have [SOME] little buds on them,No,Yes,,,,
39035:20,"and they said, bring [SOME] tapes with you.",Yes,Yes,,,,
20045:19,even better than jaws and [SOME] of that.,Yes,Yes,,,,
66700:13,"you know [SOME] people on the case were, were a little hesitant on convicting him on [SOME] of the charges",Yes; Yes,Yes; Yes,,,,
108757:10,"um, [SOME] of it, um,",Yes,Yes,,,,
91185:45,"but [SOME] of the, uh, the small, [SOME] of the larger small schools, you know, i guess around three or four thousand students have a, can offer a broader range of curriculums and things,",Yes,Yes,,,,
149748:21,"you know, particularly in [SOME] of the housing projects, uh, you know, that's, that tends  to be where a lot of that crime is focused",Yes,Yes,,,,
93765:12,"so they took [SOME] time off that, uh, they could show us around.",No,Yes,,,,
38055:13,"and i process [SOME] ratings and put, do graphics for their television stations, mumblex their clients,",Yes,Yes,,,,
87128:10,"there's [SOME] absolutely lovely and marvelous and peaceful areas in washington. regardless of the racial makeup,",No,Yes,,,,
62717:78,"but that's one thing  to be said  for credit. it, how, it gets you [SOME] muscle where you need it  .",No,Yes,,,,
44903:37,"and ma-, maybe let them have [SOME] mock, i mean uh, you know elections and stuff and vote for different people in their classes and start  really young.",No,Yes,,,,
22696:54,"i guess the weirdest thing i've ever caught  is, uh, in [SOME] of the inlets and the rivers around mumblex delaware.",Yes,Yes,,,,
61208:34,"and the, the ground will filter [SOME] of it but not all of it.",Yes,Yes,,,,
66700:68,"you know [SOME] people on the case were, were a little hesitant on convicting him on [SOME] of the charges",Yes; Yes,Yes; Yes,,,,
115343:46,"i read, uh, a lot of steven king, dean r koontz, uh [SOME] danielle steel.",Yes,Yes,,,,
102998:7,"but [SOME] of the different things we're doing , uh there's just not a time, enough time to do it all",Yes,Yes,,,,
7758:15:00,"but, there are [SOME] others out there that i don't believe  deserve the money they're getting .",No,Yes,,,,
133518:49,"well, it went pretty well, uh, other than the fact that we encountered some, uh, problems that you run across  in older homes with plumbing, which one thing led to another ,",Yes,Yes,,,,
142083:50,"some, uh, you know, i have [SOME] good shots and [SOME] bad shots.",No; No,Yes,,,,
45097:7,"now [SOME] people object during primaries,  having  to declare a party, whether republican or democrat",Yes,Yes,,,,
128696:11,they have [SOME] of those in ohio.,Yes,Yes,,,,
146829:11,you see [SOME] of the stuff,Yes,Yes,,,,
121775:13,"um, maybe [SOME] rolls and, um, i guess  some, uh, [SOME] rice or something like that.",No; No,Yes; Yes,,,,
50456:132,"you know, we, we've got folks running around here who  get, who  get degrees in basket weaving and you know, underwater psychology, or some, [SOME] ridiculous stuff like that.",No,Yes,,,,
104342:23,"and i couldn't tell whether [SOME] parts of town had started it or if it was just everybody was, was waiting for the delivery of whatever those containers were .",Yes,Yes,,,,
128305:9,"occasionally, [SOME] ice skating will come on, on a sunday or during the olympics",No,Yes,,,,
70357:25,"and, they have, of course, [SOME] pretty severe storms, winter storms, snow and that type of thing.",No,Yes,,,,
144063:31,"well, th-, there were [SOME] people that, uh, that  had a problem with that. because they found out later on that, jeez, you know, a guy will lie rather than get killed .",No,Yes,,,,
108856:73,"you can't understand what they're saying  on [SOME] of those songs which  probably is just as well on [SOME] of them, too.",Yes; Yes,Yes; Yes,,,,
141004:32,and then they'll get  to pick out [SOME] of those favorite snacks that they get  to pick  out,Yes,Yes,,,,
2345:21:00,"i, uh, have attended [SOME] seminars that  had [SOME] tapes that  went with them, but, uh, i guess not so much books although they sometimes have manuals and things,",Yes; No,Yes; Yes,,,,
19745:104,"if you ever get a chance to go over to vicksburg, the battleground at vicksburg, uh, there's an area there where there was, uh, [SOME] texas, uh, groups",No,Yes,,,,
133013:23,"um, and it really saved us [SOME] big money once.",No,Yes,,,,
11082:15,but they're predicting [SOME] more snow for our direction.,No,Yes,,,,
134301:16,"or, just have [SOME] wild flowers growing back there would be real pretty.",No,Yes,,,,
125857:6,"and [SOME] days he doesn't,",Yes,Yes,,,,
122421:31,"uh, what, what are [SOME] of the shows that you have been able  to rent   though.",Yes,Yes,,,,
54373:11,there are [SOME] kurds living in iran.,No,Yes,,,,
26057:49,"well, having, having been out of the credit game for [SOME] years now, i've gotten used to  either paying in cash or not getting it.",No,Yes,,,,
18479:6,"and [SOME] places, they, they, they really nail them for tax.",Yes,Yes,,,,
99651:29,"well, it sounds like he's got [SOME] really, you know, good strong ideas of what he wants  to do .",No,Yes,,,,
71201:52,"uh, i kn-, i'm familiar with some, [SOME] upbeat school areas,",Yes,Yes,,,,
20722:22,i know they're doing [SOME] curbside recycling as a kind of a test there.,No,Yes,,,,
42470:35,"but somewhere we've got  to come up with [SOME] money to build,  to build more, you know, and keep these people in them, you know.",No,Yes,,,,
105485:20,"but, uh, we did [SOME] water skiing , of course, and, and, uh, driving around the lake in the boat",No,Yes,,,,
168607:32,"and i thin-, there's also some, uh, i think, uh, poorer lifestyles illustrated but simply because it dominates so much discussionary time.",No,Yes,,,,
52983:20,"i know there are [SOME] good places to go  camping  along the, uh, the lakes.",No,Yes,,,,
51876:10,you get [SOME] kids in there,Yes,Yes,,,,
158476:38,"but they also did, they also did [SOME] of the teaching things",Yes,Yes,,,,
99247:72,"i think the elementary school teachers, or maybe even the middle school teachers dress a little fancier than, than [SOME] of the high school teachers, i think.",Yes,Yes,,,,
6396:60,"and then i think there's, i mean i think there's [SOME] negatives,",Yes,Yes,,,,
17721:21,"i've, uh, had [SOME] health problems that  have led me to, uh,",No,Yes,,,,
65910:42,i would like  to be a little more into investigating [SOME] of the other countries in the world and their educational problems. and to come up with something a little better than what we've got .,Yes,Yes,,,,
77759:32,but i think it would be nice if [SOME] of the parents would be around for a few more hours.,Yes,Yes,,,,
66134:57,"i, uh, i'm trying my best right now  to pay off [SOME] of mine.",Yes,Yes,,,,
16212:24,"i was going  to make some, uh, like fish chunks and dip it in the fondue.",No,Yes,,,,
70974:78,"so. but, um, that's the hardest part for us is that it's really, um, you know, budgeting and [SOME] extra things, you know, for-, that  are more, you know, nonessential items.",Yes,Yes,,,,
125802:14,"you know, [SOME] places just specialize in just real little ones",Yes,Yes,,,,
17546:43,"and, after i, i graduated, i read [SOME] of the old classics that i just bluffed my way through  and have found that i enjoy them quite a bit, too, uh,",Yes,Yes,,,,
13296:18,"there are, uh, [SOME] groups that  have their children, you know, go away for a year.",No,Yes,,,,
167359:42,"and, uh they have put plastic, plexiglas kind of stuff in [SOME] of the windows.",Yes,Yes,,,,
14833:77,"we're going  to solve, try  to solve the aids problem while, while, you know, [SOME] people are getting killed  here and there",Yes,Yes,,,,
121783:13,that would take [SOME] planning,No,Yes,,,,
148130:31,"uh, i suppose that puts me on [SOME] mailing lists and so forth, because i do get things from ski associations and things, uh, at, during the year.",Yes,Yes,,,,
155085:10,"find [SOME] extra payroll deductions is probably the only way we will be able  to, uh, do it .",Yes,Yes,,,,
168991:40,"so. but, uh, you know, for [SOME] people that's good.",Yes,Yes,,,,
162314:57,"i, i guess they would charge a little bit if there was [SOME] orthodontia or something for one of my dependents or something like that",No,No,,,,
157961:33,"and it has, um, helped us to afford [SOME] things for our children that we couldn't otherwise  that i think  are wonderful particularly at this age,",Yes,Yes,,,,
135453:35,"i know, uh, the bri-, [SOME] of the british people laugh at us because we're so enthralled with their royalty.",Yes,Yes,,,,
76160:21,"and so, i think [SOME] of the things that i did  paid off.",Yes,Yes,,,,
64969:22,and i hope you get [SOME] more calls and make [SOME] more calls.,No; No,Yes; Yes,,,,
79557:42,"i, i'm glad,  to see [SOME] of these things, i think .",Yes,Yes,,,,
81720:33,"and he's trying  to save the land from some, ooze.",No,Yes,,,,
45790:32,"now, they've been able  to get [SOME] good players and come around",Yes,Yes,,,,
1206:10:00,and then [SOME] of them are speaking in a foreign language that i don't even understand .,Yes,Yes,,,,
72488:43,"but we may have  to give up on some, [SOME] things.",Yes,Yes,,,,
117330:23,it ended up i got [SOME] furniture  back that one of them had moved  out or something.,Yes,Yes,,,,
27773:13,i listen to [SOME] country and western,Yes,Yes,,,,
141908:36,"well, it seems like, i don't know, [SOME] things are sensationalized",Yes,Yes,,,,
64299:18,"the other day we had [SOME] hail, the biggest hail i've ever seen  in texas.",No,Yes,,,,
9524:43:00,"well i mean i've had [SOME] pretty bad, i guess [SOME] pretty controversial topics",Yes; Yes,Yes; Yes,,,,
2582:17:00,well i've seen [SOME] people try  to just come in like over the weekend because they want  to use the texteller machine.,No,Yes,,,,
3372:16:00,they came up with [SOME] pretty weird stuff after that.,No,Yes,,,,
164949:21,"ended up  getting [SOME] scholarships to go to college  and which  has been, you know, which  is really nice,",Yes,Yes,,,,
66483:25,what 's amazing is [SOME] of them have been on death row for a number of years.,Yes,Yes,,,,
59544:10,"and then [SOME] of the bigger companies,",Yes,Yes,,,,
33291:14,make hot dogs or [SOME] potato chips,No,Yes,,,,
172002:14,there would be [SOME] types of crimes for which you're not guaranteed  a jury trial .,Yes,Yes,,,,
38641:36,"i've always wanted  to go back and read [SOME] of my literature texts from college um, because i enjoyed [SOME] of those stories so much,",Yes; Yes,Yes; Yes,,,,
63398:14,they even have [SOME] late night ones for people that  work second shift and things like that.,No,Yes,,,,
172589:128,"when you have the, when you have the, uh, the economy to scale and everything that a large corporation has  , and you can, uh, offer [SOME] incentive",No,Yes,,,,
136292:43,"we've been getting quite a bit, maybe not quite as bad as [SOME] of the folks down around san antonio,",Yes,Yes,,,,
153785:23,"you know, i have done [SOME] bow hunting",No,Yes,,,,
86100:26,you have  to have [SOME] compassion [SOME] humanness.,No; No,Yes; Yes,,,,
138350:6,and [SOME] ways i didn't.,Yes,Yes,,,,
103644:40,"i, i think, with solving [SOME] of the energy, future energy problems, we'll probably solve [SOME] of the pollution problems as well.",Yes; Yes,Yes; Yes,,,,
70123:18,at least y'all are getting [SOME] rain up in dallas.,No,Yes,,,,
16456:40,"you put, um, really good vanilla favoring  in it and [SOME] butter",No,Yes,,,,
31195:47,"but, uh, still i, i questioned the ability of [SOME] of the teachers to, uh, really do a bang-up job,",Yes,Yes,,,,
166876:51,i think that should be left  up to people who  have [SOME] knowledge in the subject and more knowledge than a jury would have.,Yes,Yes,,,,
28597:28,"and we, uh, got a quote on [SOME] laser printers  the other day at six hundred dollars.",No,Yes,,,,
23951:137,"and if you take, uh, little pieces of pork  and you fry them, like little cubes of pork. and you fry them with garlic and a little bit of, couple dashes of hot pepper and then mix [SOME] hoi sin sauce with sherry, just a little sherry  to thin it, and stir that in.",No,Yes,,,,
162249:54,"but, uh, there's a four o one k plan uh, for, uh, sheltering [SOME] taxable income.",Yes,Yes,,,,
154986:45,"and then i, and then they in turn will get [SOME] money from the bottlers and from the the people that  do the canning of the pop and the beer as as well.",Yes,Yes,,,,
362:44:00,"that's just a matter of defining priorities, i guess or [SOME] priorities anyway.",Yes,Yes,,,,
31533:12,and it takes [SOME] drastic steps at this point.,No,Yes,,,,
136205:15,so there has been [SOME] flooding,No,Yes,,,,
159592:14,"but, uh, [SOME] of these groups now like slaughter.",Yes,Yes,,,,
100603:25,"usually there has  to be [SOME] wealth involved, which  is great, if, if you're financially, if, if you don't make the decisions so late that you're worried about money",No,Yes,,,,
97106:13,"it's, [SOME] good, [SOME] bad, uh,",Yes; Yes,Yes; Yes,,,,
20176:47,"so i think in, in [SOME] as-, [SOME] ways we are, uh, becoming a little too egalitarian in that, in that sense,",Yes,Yes,,,,
43559:43,you wonder how in the world they ever got them to do [SOME] of these things .,Yes,Yes,,,,
82687:34,"but, you know, i know there are [SOME] days when she wi-, she wishes she was back at work .",No,Yes,,,,
16608:27,i was trying  to think about [SOME] of my favorite people that i liked  in music,Yes,Yes,,,,
160988:9,"but also [SOME] poodles, uh",Yes,Yes,,,,
12998:28,"and he, he likes [SOME] of the new groups like shenandoah,",Yes,Yes,,,,
63963:80,"i, i wonder about [SOME] of the prod-, products that they don't take , like [SOME] of the plastics and things that they don't take . uh, why, why they couldn't do more recycling with those .",Yes; Yes,Yes; Yes,,,,
72420:95,"there are a lot of jobs that  are coming about, like in computers at home, and those types of things, that  would at least in [SOME] ways, um, bridge the gap.",Yes,Yes,,,,
177493:13,i've cut [SOME] one by eight oak before.,No,Yes,,,,
84120:11,there was [SOME] plants that  are just spring bloomers,Yes,Yes,,,,
77843:15,every weekend there was [SOME] visiting somewhere.,No,Yes,,,,
123916:50,i don't know who  played when and who  does what like [SOME] guys are.,Yes,Yes,,,,
99608:4,"some schools i know  give, uh, oh,",Yes,Yes,,,,
28274:4,some kids are really having it.,Yes,Yes,,,,
38651:29,"um, i trying  to think of [SOME] of my other favorite books,",Yes,Yes,,,,
4489:44:00,"and, uh, so it's had that orientation for quite [SOME] time.",No,Yes,,,,
148463:10,"um, [SOME] of it sounds more like pop music.",Yes,Yes,,,,
71322:37,"in germany or in, in england in [SOME] cases people in my income level, at least, allege that they pay up to six-, fifty-five percent of their gross income in taxes.",Yes,Yes,,,,
152284:11,like in [SOME] of the large oil companies. there has been massive lay offs.,Yes,Yes,,,,
97229:18,or we really do develop [SOME] health problems.,No,Yes,,,,
143752:15,it seems that [SOME] of them have gotten higher,Yes,Yes,,,,
50719:6,and [SOME] people would get military service,Yes,Yes,,,,
168823:14,"but there were [SOME] things  that people brought  up like well what  happens if they, they get a false positive, you know, what recourse do you have .",No,Yes,,,,
168236:157,"uh, and really, i-, i-, we were really forced  into  keeping a budget because i'm, i'm paid once a month which  sort of, sort of forces some, uh, uh, restrictions",No,Yes,,,,
33143:60,"but there's, uh, they're a pain to peel  for [SOME] people.",Yes,Yes,,,,
20838:36,"and so, you know, when i found out [SOME] places to take it",Yes,Yes,,,,
151303:29,"well, you know, you can take [SOME] of that, that testing a little bit too far.",Yes,Yes,,,,
60960:37,"on channel thirteen, uh, they had some, [SOME] programs the day before,",Yes,Yes,,,,
75571:7,and [SOME] of the other ones weren't born.,Yes,Yes,,,,
43815:11,there's [SOME] nice stuff  over there to see .,No,Yes,,,,
26291:55,"and, and, it's, it's limited application in [SOME] respects.",Yes,Yes,,,,
55120:15,"boy, they'd [SOME] big changes, speaking of them.",Yes,Yes,,,,
7100:11:00,"well, and [SOME] people use one credit card  to pay for another credit card they own ,",Yes,Yes,,,,
71321:4,"some states they pay, uh,",Yes,Yes,,,,
138141:9,put [SOME] shelves in,No,Yes,,,,
77852:30,"we, although we have [SOME] relatives in the area that we, we see , we,",No,Yes,,,,
89259:13,i think [SOME] parents go a little bit overboard.,Yes,Yes,,,,
98986:4,"some people just sit on them once in their lifetime, you know, if they're that lucky sometimes. or, you know, what, whatever the case may be . and, and may not have any idea of what, what the standard punishment  would be  for it.",Yes,Yes,,,,
32953:16,"and i've got [SOME] broccoli, uh, onions some, [SOME] radishes and, uh, uh, beets.",No; No,Yes; Yes,,,,
166806:63,"i think that a majority of the places in the u s, uh, you know, there is [SOME] government aid available,",No,Yes,,,,
111407:85,"i was just in the shower after  finishing mowing the lawn and, you know,  mowing the lawn and removing [SOME] old petunias out of the garden,",No,Yes,,,,
160087:28,"uh, you know, as sort of [SOME] development and [SOME] training, uh,",No; No,Yes; Yes,,,,
176211:25,i'm sure there must be [SOME] good ones around here somewhere.,No,Yes,,,,
140818:41,"well, we've heard bad, we've heard [SOME] bad things about [SOME] of those, you know,",Yes; Yes,Yes; Yes,,,,
80438:40,"but when you get into [SOME] of these, [SOME] of health clubs where you just stand around and wait  .",Yes; Yes,Yes; Yes,,,,
124760:28,"that might help a little bit, especially in [SOME] places.",Yes,Yes,,,,
61917:28,and also i'm interested in writing [SOME] programs that  will kind of like remind me of things like remind me that wednesdays is trash day and the like.,No,Yes,,,,
33466:11,i got [SOME] interesting information about crawfish,No,Yes,,,,
139729:13,we've got [SOME] children,No,Yes,,,,
38592:10,"right now [SOME] of the things i'm working with  are kids that  are dealing with sexual abuse,",Yes,Yes,,,,
72079:13,"or sand even [SOME] of them,",Yes,Yes,,,,
127456:31,"oh, i, i know [SOME] of the people.",Yes,Yes,,,,
88001:23,"that would provide, uh, possibly [SOME] relief there to utilize [SOME] of the property taxes for other things, see.",No; Yes,Yes; Yes,,,,
61752:73,"so, uh, we got, we, we put dirt in the hole and then put [SOME] chicken wire around it, you know, so that he couldn't get out.",No,Yes,,,,
87240:87,"and i, i, i, i have  to think that, that it has [SOME] influence on it.",Yes,Yes,,,,
140196:19,"uh, and then what [SOME] people would consider  a little more difficult, i, i'll change spark plugs",Yes,Yes,,,,
128489:17,"but if you do [SOME] basic exercises and you say every morning, just like brushing your teeth you're going  to spend fifteen minutes or a half hour.",Yes,Yes,,,,
3878:16:00,well i've gotten [SOME] good ideas from you.,Yes,Yes,,,,
156086:35,"well, not, not as hard as [SOME] places out west because you don't get the, uh, major pollution sources as you do out in denver  with the inversion and los angeles and a-, rest of california which  is just terrible it sounds.",Yes,Yes,,,,
174581:22,"and, of course, you have [SOME] savings in terms of taxpayer money  keeping people in jail or not.",No,Yes,,,,
161281:21,"i'm into, uh, [SOME] industrial music that 's, a, a bit even harder than that.",Yes,Yes,,,,
76223:21,"anyway, it ended up after [SOME] pretty, uh, heavy bidding, that i got all those bricks for forty dollars.",No,Yes,,,,
118955:17,"these, [SOME] of these young kids you read about ,  just doesn't bother them to kill someone at all",Yes,Yes,,,,
136135:14,"he does have [SOME] real bizarre things, i think .",No,Yes,,,,
95853:38,"and, and i'm not sure but what [SOME] of the insurance claims aren't due to, uh, illnesses brought on by drug abuse or alcohol abuse.",Yes,Yes,,,,
138703:48,"same sort of problem that  happens sometimes is these, [SOME] of these, uh, like aids tests and such.",Yes,Yes,,,,
71046:43,"well, uh, but i do realize that, that is realistic for [SOME] people,",Yes,Yes,,,,
151138:37,"but, uh, they, they have done [SOME] testing around our office, mostly after lunch,  looking for people drinking, uh, drinking beer and stuff at lunch time,",No,Yes,,,,
53598:10,"we got [SOME] awful rain, uh, the other morning.",No,Yes,,,,
21020:14,"but, uh, [SOME] of the crap that 's on t v nowadays, it's about.",Yes,Yes,,,,
83988:6,"and [SOME] people will still buy them, you know,",Yes,Yes,,,,
138154:56,"uh, a few years ago, uh, we needed, uh, they needed [SOME] book shelves",No,Yes,,,,
84117:33,and i just went out this weekend and bought me [SOME] plants and stuff.,No,Yes,,,,
36312:38,"i think youngsters ought  to go out and do [SOME] public service,",No,Yes,,,,
161373:22,"but i also dislike, uh, [SOME] classical music,",Yes,Yes,,,,
168977:55,"and they have, uh, you know, in, in [SOME] cases they have a greater self-esteem because they can say, they can see that, you know, if i do something or sub-, submit my own will to the will of the sargent or whatever, at least for a short period of time, i can accomplish a lot",Yes,Yes,,,,
24443:14,"there are just [SOME] people that i, you know,",Yes,Yes,,,,
71540:47,"in fact, i was going  to go out today  to buy [SOME] plants so i could put them in,",No,Yes,,,,
62690:49,"and they say they can, you know, do something different and change [SOME] connectors",No,Yes,,,,
159588:39,"i, i even like guns and roses, [SOME] of their stuff.",Yes,Yes,,,,
125651:10,"um, [SOME] of the qualifications that i look for  was that, uh, you know, the cost, and, um, exactly what they did , if it was structured or nonstructured, if they had a little academic, um, uh, in there, and, um, you know, um, you know, what the qualifications of the teachers' were , and if the place was clean and um, the hours",Yes,Yes,,,,
9507:75,"well i guess this, the weather isn't as lively a topic as, uh, as [SOME] of the others we might have gotten .",Yes,Yes,,,,
169366:50,"and i can, i can, you know, accept that [SOME] people think it's not and can find better ways to use it .",Yes,Yes,,,,
96866:33,and so. but i know [SOME] of the other services do not think that women are capable of  doing the job.,Yes,Yes,,,,
103574:12,my line gets [SOME] static.,No,Yes,,,,
107802:43,"i, it, i have worked in [SOME] campaigns",No,Yes,,,,
110628:20,"um, but she might have [SOME] contacts here,",No,Yes,,,,
124787:54,"i really think, uh, you know, we're doing some, [SOME] important things.",No,Yes,,,,
80001:13,"i've got [SOME] applications,",No,Yes,,,,
170022:25,a couple of times we've tried [SOME] things,Yes,Yes,,,,
74155:5,some of these are urban worries,Yes,Yes,,,,
47182:40,"so, i'd go up somewhere and camp overnight and then do [SOME] rafting.",No,Yes,,,,
71600:26,"and she cooks them for an hour with [SOME] fat backs,,",No,No?,,,,
138469:69,"then, then on the other hand i think it 's harder to stay home in [SOME] regards.",Yes,Yes,,,,
82296:18,"and they were just screening [SOME] candidates,",Yes,Yes,,,,
116252:35,"i, i think there are [SOME] areas where we, where we, uh, pretty well, you know, get our money's worth ,",No,Yes,,,,
27056:5,some of them were even better behaved.,Yes,Yes,,,,
97543:11,"i have [SOME] friends that  have children,",No,Yes,,,,
135035:25,"i, i do [SOME] sewing, mostly out of necessity.",No,Yes,,,,
173724:18,"and by definition, for [SOME] of us, at least, the public good includes having an educated populace and then idea that, uh, you can make a sound judgment with respect to small votes in the, at the local level or bigger votes at the national level.",Yes,Yes,,,,
